cb_org_id,description
2c052dd9-cf36-f674-4c7e-0002b58a8f6a,"The future of infectious disease diagnostics starts at Day Zero. By using whole-genome sequencing (WGS) and our proprietary enabling technologies, Day Zero is creating a new class of sequencing-based in-vitro diagnostics that generates clinically actionable data at scale. Our technologies include novel sample preparation methods enabling unprecedented ultra-high enrichment of pathogen DNA for sequencing directly from clinical samples, machine learning algorithms that provide clinically actionable diagnostic results, and a world-class database of WGS and drug efficacy profiles. Day Zero Diagnostics is on a mission to transform the way infectious disease diagnostics are performed by generating the stream of real-time sequencing data required to change how we track, manage and combat infectious diseases. With an enormous unmet clinical and economic need, we are targeting bloodstream infections and sepsis for our first application. The life expectancy of a patient with septic shock is 24 hours without fast effective antibiotic treatment. However, even when successful, current diagnostics take 2-5 days to identify the pathogen AND provide its antibiotic susceptibility profile. The lack of rapid, accurate, and comprehensive diagnostics, forces physicians to “carpet bomb” patients with severe infections with powerful, yet toxic, broad-spectrum antibiotics, which is not only ineffective in many cases but can also lead to significant morbidity and mortality. Day Zero delivers a complete diagnosis, including both the species and antibiotic resistance profile, in hours vs. days, enabling the physician to use a targeted treatment on day zero of hospital admission and resulting in better patient outcomes and cost savings."
a3a90904-346f-de54-b7bc-fa82d2862672,"Insilico Medicine develops an AI platform for drug development to treat cancer and age-related diseases. It pioneered the applications of the generative adversarial networks (GANs), reinforcement learning, transfer learning, and meta-learning for the generation of novel molecular structures for the diseases with known and unknown targets, and, unlike the other companies in the field, is developing the end-to-end pipeline covering every step of drug discovery, clinical trials analysis, and digital medicine. Insilico Medicine is pursuing internal drug discovery programs in cancer, dermatological diseases, fibrosis, Parkinson's Disease, Alzheimer's Disease, ALS, diabetes, sarcopenia, and aging. Through a partnership with Life Extension, the company launched a range of nutraceutical products, which were compounded using advanced bioinformatics techniques and deep learning approaches. It also provides a range of consumer-facing applications including Young.AI."
34174f65-c4a4-db49-1ed1-c7a12d9155dd,"Verge Genomics transforms drug discovery with artificial intelligence. Verge was founded by a unique combination of the field's top machine learning experts and seasoned neuroscience drug developers. Together, they share the vision that exponential advances in computational genomics combined with new insights into neuroscience has created a breakthrough opportunity to discover drugs that dramatically improve the lives of patients suffering from neurodegenerative disease."
5aa29422-5a44-8e42-98d6-841fa98f5d14,"RowAnalytics is delivering a range of highly innovative data analytics platforms, which power the next generation of precision medicine, IoT and digital health solutions. RowAnalytics’ tools and components allow the delivery of fully personalized solutions for scientists, clinicians, carers and patients in a secure, faster and cost effective manner. We focus on delivering analytical tools that are powerful enough to manage huge, complex datasets, and efficient enough to be deployed across PC, wearable, mobile and embedded devices."
a2df96a5-44b5-4dca-851a-28b730d0acba,"GenomeKey is an award-winning, early-phase company that is exploiting innovative genomic technology and cutting-edge AI machine learning to address critical healthcare challenges."
2050f486-8895-a7fc-20e6-d011d1cbfe95,"Enthought transforms the business of science with artificial intelligence. When hard science is mission critical, we’ll help you win in an AI-powered world. Discover What Matters Shape AI strategies to solve hard science. Make just-right investments to transform business-critical chemistry, physics, biology, and beyond. Unlock Hidden Value Turn scientific data into on-target business insights. We help you integrate and interact with masses of data to ask the right questions and unlock the best opportunities. Solve Really Hard Problems Go beyond brainpower to tackle problems that seem out of reach. From analyzing the Earth’s crust to mapping the human genome, speed ahead with AI attuned to the most challenging scientific requirements. Optimize Your People Spur innovation by teaching your best thinkers to command AI. Free scientists and engineers up to ask the right questions, expand the field of inquiry, and make intuitive leaps. At Enthought, we believe we're smarter together. Let's empower your best thinkers to move faster and discover more."
7e4f6f27-f31f-4e8b-919a-c90ab2a778f5,"Immunai is a biotech company that combines single-cell genomics with ML algorithms to enable high-resolution profiling of the immune system. Immunai's mission is to map the entire immune system and its functions using single-cell genomics and machine learning. Immunai leverages single-cell technologies to profile cells from a blood sample, and uses machine-learning algorithms (powered by its proprietary database) to map the hundreds of cell types and their states to create an immune profile. They work on biomarker discovery and insights that identify how a cell responds to its changing environment. The company is located in New York City, San Francisco, and Tel Aviv, Israel."
c439ff57-523a-4dbb-b353-3c49ebf49414,"Diversity Arrays Technology Pty. Ltd. offers generic and genotyping technology products and services such as genome profiling, genetic id typing, statistical analysis, breeding/crop performance evaluation, associated resources, DNA sequencing, data analytics, genomics, biosecurity, machine learning, breeding, farming, ecology, agriculture, data, and breeding software."
335d7377-88f1-acc9-586b-92afcbc0487e,"Biomatters creates applications for omics analysis. Our WebApp Development Group builds production quality, public- and private cloud based responsive web applications to deliver the highest usability and visualized insight for applied genomics workflows. By collaborating with clinical and molecular diagnostics developers, we build the platforms that crunch their data and deliver results reports to their customers. We turn genomic research workflows into production-ready, regulatory-compliant diagnostic pipelines. Geneious, our desktop app for research biologists, features tools for DNA/RNA/protein sequence analysis, data management, database searching, and publication-quality image generation. Geneious is used by university, government, and medical research labs worldwide in disciplines such as agricultural genomics, evolutionary biology, biofuels, synthetic biology, microbiology, virology, and next-gen sequence analysis."
081785db-57aa-02a2-d7bc-b691c7b7592e,"Athleticode provides personalized genetic testing to athletes. Athleticode tests for unique DNA Codes associated with major sports injuries such as ACL rupture and sport concussion. Through its Player Report, Athleticode combines this information with personalized pre-habilitation training exercises and other personalized strategies to help athletes reduce sport injury risk and enhance performance."
228897f7-d6f9-484c-9581-4c4ed8f27039,"EvokAI is a MedTech AI-powered company dedicated to the development of transformational and innovative technologies for the modern healthcare sector. It deploys machine learning models to search medical data and uncover insights to help improve health outcomes, patient experiences, drug development, preclinical and clinical decisions and provide more accurate diagnoses. EvokAI tailors its AI algorithms across the whole healthcare system, from hospitals, private clinics, research institutions, pharmaceutical companies, and contract research organizations, to medical professionals, patients, and healthy individuals aiming at preventing any kind of disease and beyond, protecting the aging genome."
204c9e8a-728d-de44-e190-7d40d0b29054,"Bina Technologies is accelerating the future of personalized, data-driven healthcare. Mission:- They are redefining the future of medicine. Join us to change the world! Description:- They build high performance data analysis solutions that dramatically reduce the time, cost and complexity of creating knowledge from data."
ae020f38-6367-474b-a755-5eaf190e1f7a,"XLabs builds AI to amplify humans. We build meaningful futuristic moonshots powered by artificial intelligence, quantum computing and neurotech. Each of our breakthroughs cascade on top of a core meta-learning AI. An evolution on Silicon Valley’s past models, we use next-gen technologies to change 3 future slices of the world: culture, genetics and the internet."
0963c051-3aa2-f0ce-9e05-42359d05eac0,"LifeMine Therapeutics combines genomics with AI and synthetic biology to discover and develop a pipeline of novel medicines. LifeMine’s Avatar-Rx platform integrates high-throughput microbiology, data science and machine learning, genome engineering, and automation technologies to search the fungal biosphere for novel GEMs having a predetermined target and biological function. The platform integrates chemoinformatic-assisted drug optimization and state-of-the-art chemical synthesis with biotransformation to advance new product candidates into development. Founded by Gregory Verdine, PhD, Rick Klausner, MD, and WeiQing Zhou, MBA. LifeMine Therapeutics is headquartered in Cambridge, Massachusetts."
d4207ef6-2562-d4ef-ae35-b6cbd66fb1de,"GenLife is making the future of insurance intelligent, inclusive and dynamic. They are building a platform from applying machine learning to their insurance partners' life and health insurance primary data sets to drive down transaction costs, increase automation and improve risk-pricing in underwriting, claims and fraud management.  The platform is being built to be hardware/device agnostic and integrate with future forward-looking data sources such as genomics, geo-location, social, and healthtech. Their insurance partners win when they remove friction, costs and inefficiencies from their operations and their customers' experience.  People win when they transform their insurance from an annual cost to a personalized asset which proactively protects their life and health."
557833ba-9a05-0bce-4763-be422fef0f86,"Seven Bridges is the industry-leading infrastructure and data analytics company accelerating precision medicine by enabling the understanding of biomedical data.  Our platform, services, and support expertise are driving discovery and drug development at the world’s leading academic, biotechnology, government, hospitals, and pharmaceutical entities. Through our collaborations with the largest genomics projects, we connect the world’s biomedical information to enable the most efficient analysis at scale.  Named one of the world's smartest companies by MIT Technology Review, and a three-time Bio-IT World Best of Show winner, Seven Bridges has offices in Belgrade, Boston, Istanbul, and San Francisco."
08cc2fee-4d22-4872-9765-67832ffa3149,"EpiCombi.AI is a genomics signature-driven therapeutics spinout from Oxford University, is overcoming epigenetic barriers in cancer complexity through the creation of AI-derived, network-acting multi-targeted drugs."
df967e62-a2ef-d019-3cce-e2b4942a0396,"Emedgene provides data-driven AI solutions for genomic diagnostics and discovery at scale. The company works with top healthcare and life sciences organizations to enable precision medicine programs, power high throughput diagnostics, and accelerate the pace of research."
f4dd1412-694a-0d64-850d-3b3f37b59e1d,"Fabric Genomics is making genomics-driven precision medicine a reality. We provide clinical decision support software that enables clinical labs, hospital systems and country-sequencing programs to gain actionable genomic insights, resulting in faster and more accurate diagnoses and reduced turnaround time. Fabric’s end-to-end genomic analysis platform incorporates proven AI algorithms, and has applications in both hereditary disease and oncology. Headquartered in Oakland, California, Fabric Genomics was founded by industry veterans and innovators with a deep understanding of bioinformatics, large-scale genomics and clinical diagnostics."
4d278e7c-25ec-4c81-ba5c-de50cf1eaccb,"Altered Silicon develops specialized hardware + Blockchain solutions utilizing FPGA (Field Programmable) processors. More and more, FPGAs are being used for Networking, Data Analytics, Finance, Genomics, Image Processing & Machine Learning. They are where Hyperscale Computing meets Blockchain."
faf8636c-60bd-4ea4-96fa-865a3685d6a9,"Allelica is a genomics software company driving the transition of Polygenic Risk Score from Genomic research to clinical application. The company uses cutting-edge genomics technology and machine learning algorithms to accelerate research and translational clinical genomics in Precisione Medicine.  It was founded in 2018 and is headquartered in New York, United States."
72661067-765b-448b-a681-2fcf37f0b887,"DNAvisit utilizes AI in genetic counseling and testing for use by physicians and individuals in family planning, genomics, and DNA analysis."
92d1b813-0603-44df-add0-73d8869fb904,Digital model of a cancer patient to predict therapy effect and clinical trial outcome using AI & deep learning
914fcbb9-be98-f349-99be-cae15b4ff632,"Deep Genomics recruits from among the top 1% of recent graduates and seasoned experts at the intersection of genomics, drug development and AI."
bcaaf6f8-0e96-4409-b8ae-eab606a57e16,"AMPEL BioSolutions is a precision medicine company with a development pipeline of CLIA-certified gene expression tests for blood or tissue samples that provides decision support by determining disease status, identifying molecular pathway and predicting drug options. Genomic platform, bioinformatics, RNA analytics and ML/AI algorithms covered by patents & are disease agnostic. AMPEL BioSolutions was founded to bring personalized precision medicine to patients with immune system and inflammation diseases. In 2022, AMPEL expects to commercialize its first product, a CLIA-certified blood test for lupus patients/physicians called LuGENE® that assesses disease state/flares and best drug option(s). AMPEL's technology covers over 95% of all known genes and is disease agnostic so there is capacity to expand reporting of results into new disease indications without developing a new test. AMPEL's exclusive curated database of >10,000 Lupus patient gene expression profiles with rich clinical information is the world's largest and fuels machine learning predictions based on evidence. AMPEL's customers are Pharma/Biotech, utilizing its proprietary genomic platform, bioinformatic tools, and ML/AI algorithms for clinical trial design/management and patient stratification. For more information, visit: http://ampelbiosolutions.com/"
52884154-6a90-1300-9116-0428d7c02637,"Biomiic is a fast and accurate microbiome sequencing service for the masses. They utilize high-throughput metagenomic (shotgun) sequencing to deliver high-dimensional, high-coverage genomic information about bacteria and viruses present in the human body"
74213814-354d-b7a4-15ac-65818f662a1c,Cutting edge European Technology in genetic sequencing and analysis.
9e3eead1-c3a4-4e73-aacd-98cbebf3a997,"Clear Gene detects remaining solid tumors using genomics and machine learning. Residual Illness Cancer that persists after therapy is known as residual illness. A succession of technological breakthroughs in residual disease identification has assisted patients with liquid tumors.  To detect a remaining solid tumor, they employed genomics and machine learning.  Patients with solid tumors like breast cancer, on the other hand, have been left behind. Until now, that is. Cancer that persists after therapy is known as residual illness.  Life-changing innovations need an atmosphere that encourages unconventional thinking while still rewarding rigorous product development.  They work on both the high and low end of the innovation spectrum."
603aebe0-e49d-4dbd-8a46-34c6367f984f,"MultiplAI leverages genomics and AI to provide universal remote screening for cardiovascular diseases among other complex diseases. We use a liquid biopsy of whole blood based on RNA sequencing and deep learning looking at all biomarkers in the blood, thus creating a superb biomarker to detect diseases earlier. Our test can be used in continuous testing both for preventative screening and post-treatment monitoring. Given that it requires only a simple blood sample, it can be administered remotely, anywhere, and costs a fraction of existing diagnostic methods."
8cc1c34b-1927-471a-8f04-7bcd1a8d2a7d,"ArsenalBio is building a programmable cell therapy company to create highly effective and accessible immune cell therapies to impact outcomes for a much broader number of patients, initially those with cancer. Founded in 2019, ArsenalBio is focused on integrating technologies such as CRISPR-based genome engineering, scaled and high throughput target identification, synthetic biology, and machine learning to advance a new paradigm to discover and develop in immune cell therapies. With its programmable and computationally driven approach, ArsenalBio aspires to evolve critical metrics of success for immune cell therapies, including enhanced and broader efficacy, increased patient safety, reduced provider costs, and expanded market access."
59ac8f74-8ccd-42f2-a90e-749b4df8fad3,NuGenomics is a machine learning and artificial intelligence-based human genomics company.
440d7d4a-cc5c-1aca-c5cb-c0a80b18165d,"AI Therapeutics was founded in 2013 with a mission to advance the clinical development of new therapies to treat Lymphangioleiomyomatosis (LAM) and other diseases. Working with a dedicated team of scientific, clinical, and drug development experts, AI Therapeutics expects to use its disease-specific focus and technological approach to identify and advance drugs that will provide significant therapeutic benefits for LAM patients. AI Therapeutics develops drugs for rare diseases and cancer. LAM takes advantage of the inflection point in biological understanding and computer science, leveraging big data from NextGen sequencing, genome editing, chemical genomics, and combinational drug screening, to develop precision therapeutics and companion diagnostics. LAM has advanced two drugs into the clinic: LAM-001 for lymphangioleiomyomatosis, and LAM-002 for B-cell non-Hodgkin lymphoma."
cd18e870-b44a-4bd3-840a-b4e14f81cbde,"NonExomics integrates genomics, transcriptomic, and proteomics data by utilizing proprietary machine learning approaches to predict structures of nonexomic proteins and identifies disease-specific nonexomic targets, allowing clients to find cures for rare diseases."
d9112887-3385-461b-a1b3-029d4344830d,"At the junction of precision medicine and behavioral health, our vision is to reduce suicide, stigma, and suffering in silence. Our products and services include: - PTS-ID is a genomics test that provides objective information to help clinicians confidently and quickly assess patients with cortisol dysregulation associated with PTSD. Results of the test can be combined with behavioral risk survey data to give clinicians a whole-picture view of the patient’s state, enabling earlier, more targeted PTSD treatment. Polaris’ TruNorth Platform provides comprehensive utilization of integrated data sources that creates a complete picture of patient health and PTSD risk.  TruGen-1 is a 1003-gene panel that supports genomic research across a spectrum of neuropsychiatric conditions. Endeavor Lab is a nimble high-complexity CLIA lab that offers a wide variety of genomic sequencing, analysis, and lab testing services, including next-generation sequencing, CLIA / CAP clinical genetic testing, and assay processing, ushering a more in-depth understanding of neuropsychiatric conditions, and enabling the development of - and access to - precision diagnostics. PTSD diagnostics and pandemic era Covid-19 testing are in this company’s DNA, but Polaris is also well versed in immunology and virology, and fluent in leveraging the power of genomics and machine learning."
475da5de-4162-f229-218f-7ddb4d164e44,"Massive Bio, is an Artificial Intelligence (AI) powered platform that connects cancer patients and their treating oncologists to clinical trials while enabling pharmaceutical companies to get access to patients, mostly in community practices, and their information to speed up drug development. Massive Bio combines technology, services and oncology sub-specialist expertise to maximize trial enrollment. Massive Bio is the first company that attacks controlling patient enrollment value chain; Massive Bio does patient identification through direct direct and indirect patient acquisition channels, pre-screening through virtual site, Just-In-Time (JIT) site activation and further analyzes real world data for drug discovery. One of the major differentiating point of Massive Bio is that the Company tackles “last mile” issues for trial enrollment to eliminate site and/or financial considerations of patients. Massive Bio is the go to partner for pharmaceutical companies and CROs to get the right patient at the right time."
af0e4c0d-f3ea-43da-8875-34b2216bdaa9,"Biogenick Life is first of its kind of company in India which passionately translates Genomic, Clinical, Wearable IoT and Life style data through its AI algorithm to assess personalize health risk and recommend -- “One step towards better life”."
5ca0eab1-a419-495f-902a-21962d86f060,Patch Biosciences expertise in synthetic biology and machine learning with a platform to engineer gene therapies and medicine.
b04c0cea-54e1-4f7e-9d13-e2362ef135ec,"Dropprint Genomics provides cell technology and machine learning models that characterize the immune system. It offers big data to the immune system by generating personalized maps of a patient's immune systems to better understand, control, and improve immune health."
ee7a5115-6826-b621-de7c-7e90d48ca39e,"Genoox uses the power of the community to make genomic data actionable, with a mission of creating the largest real world evidence network of genomic and clinical data. Genoox’s cloud-based AI platform connects clinicians, genetic counselors, and healthcare organizations to create a network effect by sharing genetic insights, enabling platform users to make impactful discoveries using the most advanced genomic tools and applications. Genoox is used by over 1,700 health organizations, hospitals and medical facilities in 44 markets across the globe Amir Trabelsi and Moshe Einhorn founded Genoox in 2014, with its headquarters in Palo Alto in California."
d7628218-ba63-4f40-91fe-47c40771395d,Biotia is a health tech company spun out of Cornell Tech leveraging next-generation sequencing and artificial intelligence for rapid precision infectious disease discovery. Our software and laboratory technology enable clinicians and researchers to guide patient treatment and improve health outcomes.
ea23ea10-bac3-0b08-4afe-1ede92ec1eab,"Regeneration is a New Health Care System based on Integrative Medicine, combining the best of evidence based medicine and Machine Intelligence to optimize your health.   Focused on Women and Children's Health through the Circle of Time Approach. Offering a free end to end solution to connect, collect and curate personalized health recommendations based on your laboratory, blood, genomic, microbiome, and wearable health data.  Our mission is to make Healthcare affordable and accessible to every human on earth. By removing Silos and integrating everything into one ecosystem, where the information and patient can flow freely across the landscape.   We do this by catering to people's needs before they need them. Our focus is early detection, prevention, and reversal of chronic disease conditions.  We exist to keep you at peak health. Rather than wait for you to get sick."
